{
  "id": "FO-0013",
  "referencia": {
    "titulo": "Estudo das interações polifenol-proteína e das reações de escurecimento não-enzimático para o processamento de cajuína",
    "instituicao": "UFRN (pelo endereço do repositório; não lido)",
    "ano": "2007",
    "tipo": "não lido",
    "link_permanente": "https://repositorio.ufrn.br/jspui/handle/123456789/15738"
  },
  "tipo_evidencia": "escrito publicado, de arquivo ou oficial",
  "data_fonte": "2007",
  "url": "https://repositorio.ufrn.br/jspui/handle/123456789/15738",
  "wayback": "sem cópia arquivada",
  "data_acesso": "2026-10-29",
  "perspectiva": "não lido",
  "deriva_de": [],
  "entrada": "EN-0694",
  "protecao": {
    "licenca": "não conferido",
    "consentimento": "não se aplica",
    "restricao_comunitaria": "nenhuma conhecida",
    "precisao_lugar": "não se aplica",
    "dado_sensivel": false,
    "crianca_ou_adolescente": false,
    "pedido_de_retirada": "nenhum"
  },
  "nota": "lida pelo ler_fonte.py: https://repositorio.ufrn.br/jspui/handle/123456789/15738 (html)",
  "origem_registro": {
    "criado_por": "scripts/gravar_extracao.py (gravar-extracao-0.1)",
    "data": "2026-10-29",
    "execucao": "EX-0046"
  }
}
